{
  "revisionId": "77777777-7777-4777-8777-777777777777",
  "taskId": "11111111-1111-4111-8111-111111111111",
  "title": "合成决策包",
  "status": "DRAFT",
  "generatedAt": "2026-09-26T09:02:00Z",
  "findings": [
    {
      "code": "REVIEW_REQUIRED",
      "severity": "MEDIUM",
      "summary": "存在待专业人员确认的合成发现",
      "evidenceIds": ["88888888-8888-4888-8888-888888888888"]
    }
  ],
  "evidenceRefs": ["88888888-8888-4888-8888-888888888888"]
}
